{
  "@context": {
    "@vocab": "http://schema.org/",
    "oer": "http://oerschema.org"
  },
  "@id": "https://example.org/test#webpage",
  "@type": [
    "LearningResource",
    "WebPage"
  ],
  "name": "anything",
  "url": "http://example.org/test",
  "teaches": {
    "@id": "http://example.org/concept",
    "@type": "DefinedTerm",
    "name": "Add and subtract within 20",
    "termCode": "CCSS.MATH.CONTENT.1.OA.C.5",
    "inDefinedTermSet": "Common Core State Standards. Math."
  }
}
